{
  "$schema": "https://json-schema.org/draft/2020-12/schema",
  "$id": "https://conduit.protocol/schemas/deployment-manifest-1.json",
  "title": "Conduit deployment manifest",
  "description": "Shape defined by CONDUIT_PRD_v1.0.md section 17.3. Every deployment writes one manifest here; PRD FR-014 requires the public verifier to consume it without trusting the application database.",
  "type": "object",
  "additionalProperties": false,
  "required": [
    "deploymentId",
    "protocolVersion",
    "gitCommit",
    "solcVersion",
    "chainConfigs",
    "contracts",
    "bytecodeHashes",
    "wormhole",
    "cleanverseAssetSnapshotHash",
    "validatorRuleHashes",
    "timestamp",
    "finalityProfile",
    "complianceProfile"
  ],
  "properties": {
    "deploymentId": {
      "description": "Domain separator bound into every intent and every cross-chain message header.",
      "type": "string",
      "pattern": "^0x[0-9a-f]{64}$"
    },
    "protocolVersion": {
      "type": "integer",
      "minimum": 1
    },
    "gitCommit": {
      "type": "string",
      "pattern": "^[0-9a-f]{40}$"
    },
    "solcVersion": {
      "description": "Exact compiler, never a range. Must equal toolchain.json solidity.solc.",
      "type": "string",
      "pattern": "^[0-9]+\\.[0-9]+\\.[0-9]+$"
    },
    "chainConfigs": {
      "type": "object",
      "additionalProperties": {
        "type": "object",
        "additionalProperties": false,
        "required": ["nativeChainId", "wormholeChainId", "rpcUrlEnvVar", "finalityBlocks"],
        "properties": {
          "nativeChainId": {
            "type": "integer",
            "minimum": 1
          },
          "wormholeChainId": {
            "type": "integer",
            "minimum": 1
          },
          "rpcUrlEnvVar": {
            "type": "string",
            "minLength": 1
          },
          "finalityBlocks": {
            "type": "integer",
            "minimum": 0
          }
        }
      }
    },
    "contracts": {
      "type": "object",
      "additionalProperties": {
        "type": "object",
        "additionalProperties": false,
        "required": ["chain", "address"],
        "properties": {
          "chain": {
            "type": "string",
            "minLength": 1
          },
          "address": {
            "type": "string",
            "pattern": "^0x[0-9a-fA-F]{40}$"
          }
        }
      }
    },
    "bytecodeHashes": {
      "description": "keccak256 of deployed runtime bytecode, recomputable from source because foundry.toml sets bytecode_hash=none and cbor_metadata=false.",
      "type": "object",
      "additionalProperties": {
        "type": "string",
        "pattern": "^0x[0-9a-f]{64}$"
      }
    },
    "wormhole": {
      "type": "object",
      "additionalProperties": {
        "type": "object",
        "additionalProperties": false,
        "required": ["coreAddress", "wormholeChainId", "consistencyLevel"],
        "properties": {
          "coreAddress": {
            "type": "string",
            "pattern": "^0x[0-9a-fA-F]{40}$"
          },
          "wormholeChainId": {
            "type": "integer",
            "minimum": 1
          },
          "consistencyLevel": {
            "type": "integer",
            "minimum": 0,
            "maximum": 255
          }
        }
      }
    },
    "cleanverseAssetSnapshotHash": {
      "description": "Hash of the signed query_deposit_atoken_list snapshot. PRD 2.4 forbids hardcoded A-Token addresses.",
      "type": "string",
      "pattern": "^0x[0-9a-f]{64}$"
    },
    "validatorRuleHashes": {
      "description": "Hash of the normalized Cleanverse validator/rules response per registered pool. PRD 9.6 forbids reinterpreting the rules locally.",
      "type": "object",
      "additionalProperties": {
        "type": "string",
        "pattern": "^0x[0-9a-f]{64}$"
      }
    },
    "timestamp": {
      "description": "UTC, per the CLAUDE.md repository rules.",
      "type": "string",
      "format": "date-time"
    },
    "finalityProfile": {
      "description": "Minimum Wormhole finality Conduit enforces per message class, bound into the bytecode as an immutable. PRD FR-014 lets a verifier bootstrap from this manifest, and which profile is live is a security property rather than a tuning detail: an authentic VAA below the settlement level is refused, because parseAndVerifyVM proves guardians signed a message and not that the source state is irreversible.",
      "type": "object",
      "additionalProperties": false,
      "required": ["settlement", "observation"],
      "properties": {
        "settlement": {
          "description": "Required for every message that authorizes an irreversible economic outcome.",
          "enum": ["INSTANT", "SAFE", "FINALIZED"]
        },
        "observation": {
          "description": "Required for messages that inform rather than authorize.",
          "enum": ["INSTANT", "SAFE", "FINALIZED"]
        },
        "note": {
          "type": "string"
        }
      }
    },
    "complianceProfile": {
      "description": "Commit-time compliance authority. `maxAttestationValiditySeconds` is a constructor immutable and is therefore covered by the bytecodeHashes above; the signer set and quorum are live contract state and are recorded here as a snapshot a verifier should re-read rather than trust. A quorum of zero means the contract refuses every commit and holds every release, which is the safe direction to fail and is not a configured deployment. ADR-0014.",
      "type": "object",
      "additionalProperties": false,
      "required": ["maxAttestationValiditySeconds", "signerCount", "quorum", "snapshotIsLiveState"],
      "properties": {
        "maxAttestationValiditySeconds": {
          "type": "integer",
          "minimum": 1
        },
        "signerCount": {
          "type": "integer",
          "minimum": 0
        },
        "quorum": {
          "type": "integer",
          "minimum": 0
        },
        "snapshotIsLiveState": {
          "const": true
        },
        "note": {
          "type": "string"
        }
      }
    }
  }
}
