{
  "deploymentId": "0x893ca44ecf017ba183180fb358fbc27ed570df9e56d7d35a465a9ed5cb1a9417",
  "protocolVersion": 1,
  "gitCommit": "b23cfb87a86d88248c16d7d3be1e3b9cc79b0787",
  "solcVersion": "0.8.36",
  "chainConfigs": {
    "monadTestnet": {
      "nativeChainId": 10143,
      "wormholeChainId": 10009,
      "rpcUrlEnvVar": "MONAD_TESTNET_RPC_URL",
      "finalityBlocks": 1
    }
  },
  "contracts": {
    "SettlementCoordinator": {
      "chain": "monadTestnet",
      "address": "0x0AEBe99A17796325Da45E49Ef3Ba8BD13bbE5c86"
    },
    "CashEscrow": {
      "chain": "monadTestnet",
      "address": "0xee40c930Be5A67E9fC8F6237E9aca2B94A8Bd85b"
    },
    "ConduitSandboxSettlementCVA": {
      "chain": "monadTestnet",
      "address": "0xe32825bb4BF312688233f68aBde3Eb6dCbc89caf"
    },
    "ConduitVaultRegistrar": {
      "chain": "monadTestnet",
      "address": "0x3FFd39444EBba2307B34c5F36F96e4e04511EBA5"
    }
  },
  "bytecodeHashes": {
    "SettlementCoordinator": "0xa8998e3674c57f90ae8205fa5b87c2ccbce32a75e09ef7c5b96a0de8f0b61dfe",
    "CashEscrow": "0x5284f0fd116489a8348d64614a595847bf937e8da4d990d5f9900787b776bfae",
    "ConduitSandboxSettlementCVA": "0x17869cb56e2de012a6c8f37ab69f944d05350b3c066a571387462fee7de2485a",
    "ConduitVaultRegistrar": "0x1f84807a372a2a58148b0fc963bd5c2ed7f9778e995fda60fe201161adfef73f"
  },
  "wormhole": {
    "monadTestnet": {
      "coreAddress": "0xaBf89de706B583424328B54dD05a8fC986750Da8",
      "wormholeChainId": 10009,
      "consistencyLevel": 1
    }
  },
  "finalityProfile": {
    "settlement": "FINALIZED",
    "observation": "INSTANT",
    "note": "Enforced on chain per message class and bound into the bytecode as an immutable, so the codeHash above covers it. An authentic VAA below this level is refused: parseAndVerifyVM proves guardians signed, not that the source state is irreversible."
  },
  "complianceProfile": {
    "maxAttestationValiditySeconds": 900,
    "signerCount": 1,
    "quorum": 1,
    "snapshotIsLiveState": true,
    "note": "The validity window is a constructor immutable and is covered by the bytecode hash. The signer set and quorum are live state: re-read them rather than trusting this snapshot. ADR-0014."
  },
  "cleanverseAssetSnapshotHash": "0x764fd8b5a8afd11ffdb2d492257d86f3daeea79bf2e0b592ec837d303a48e918",
  "validatorRuleHashes": {},
  "timestamp": "2026-08-08T14:25:52.037Z"
}
